sequenceID	sequenceID_RT	NCBI_ref	clade	subfamily	genus	subgenus	ictv-species-name	examplar virus name	full_name	name	isolation_host	host_common_name	length
AF033818	AF033818_BLV_RT	NC_001414	II	Orthoretrovirinae	Deltaretrovirus		Deltaretrovirus bovleu	Bovine leukemia virus	Bovine leukemia virus	BLV	Bos taurus	Domestic cow	8419
DQ093792	DQ093792_PTLV3_RT		II	Orthoretrovirinae	Deltaretrovirus		Deltaretrovirus priTlym3	Primate T-lymphotropic virus 3	Primate T-lymphotropic virus 3	PTLV3	Homo sapiens	Human	8917
EF488483	EF488483_PTLV4_RT		II	Orthoretrovirinae	Deltaretrovirus		Deltaretrovirus priTlym4	Primate T-lymphotropic virus 4	Primate T-lymphotropic virus 4	PTLV4	Homo sapiens	Human	8791
M10060	M10060_PTLV2_RT	NC_001488	II	Orthoretrovirinae	Deltaretrovirus		Deltaretrovirus priTlym2	Human T-lymphotropic virus 2	Human T-lymphotropic virus 2	PTLV2	Homo sapiens	Human	8952
AF033817	AF033817_PTLV1_RT	NC_001436	II	Orthoretrovirinae	Deltaretrovirus		Deltaretrovirus priTlym1	Primate T-lymphotropic virus 1	Primate T-lymphotropic virus 1	PTLV1	Homo sapiens	Human	9028
AF033808	AF033808_RSV_RT	NC_001407	II	Orthoretrovirinae	Alpharetrovirus		Alpharetrovirus avirousar	Rous sarcoma virus	Rous sarcoma virus	RSV	Gallus gallus	Domestic chicken	9392
M37980	M37980_ALV_RT	NC_001408	II	Orthoretrovirinae	Alpharetrovirus		Alpharetrovirus avileu	Avian leukosis virus - RSA	Avian leukosis virus - RSA	ALV	Gallus gallus	Domestic chicken	7286
AF033807	AF033807_MMTV_RT	NC_001503	II	Orthoretrovirinae	Betaretrovirus		Betaretrovirus murmamtum	Mouse mammary tumor virus	Mouse mammary tumor virus	MMTV	Mus musculus	Domestic mouse	8805
AF033815	AF033815_MPMV_RT	NC_001550	II	Orthoretrovirinae	Betaretrovirus		Betaretrovirus maspfimon	Mason-Pfizer monkey virus	Mason-Pfizer monkey virus	MPMV	Macaca mulatta	Rhesus macaque	8557
M23385	M23385_SMRVH_RT	NC_001514	II	Orthoretrovirinae	Betaretrovirus		Betaretrovirus squmon	Squirrel monkey retrovirus-H	Squirrel monkey retrovirus-H	SMRVH	Saimiri	Squirrel monkeys	8785
M80216	M80216_JSRV_RT	NC_001494	II	Orthoretrovirinae	Betaretrovirus		Betaretrovirus ovijaa	Jaagsiekte sheep retrovirus	Jaagsiekte sheep retrovirus	JSRV	Ovis aries	Domestic sheep	7462
M32690	M32690_BIV_RT	NC_001413	II	Orthoretrovirinae	Lentivirus		Lentivirus bovimdef	bovine immunodeficiency virus	Bovine immunodeficiency virus	BIV 	Bos taurus	Domestic cow	8482
U21603	U21603_JDV_RT	NC_001654	II	Orthoretrovirinae	Lentivirus		Lentivirus bovjem	Jembrana disease virus	Jembrana disease virus	JDV 	Bos javanicus domesticus	Balinese cattle	7732
M16575	M16575_EIAV_RT		II	Orthoretrovirinae	Lentivirus		Lentivirus equinfane	Equine infectious anemia virus America strain	Equine infectious anemia virus America strain	EIAV 	Equus caballus	Domestic horse	8407
M25381	M25381_FIV-P_RT		II	Orthoretrovirinae	Lentivirus		Lentivirus felimdef	Feline immunodeficiency virus Petaluma strain	Feline immunodeficiency virus Petaluma strain	FIVP	Felis catus	Domestic cat	9474
U03982	U03982_PLV_RT	NC_038669	II	Orthoretrovirinae	Lentivirus		Lentivirus pum	Puma lentivirus 14	Puma lentivirus 14	PLV	Puma concolor	Puma	9100
M33677	M33677_SRLV-B_RT		II	Orthoretrovirinae	Lentivirus		Lentivirus capartenc	Small ruminant lentivirus genotype B (Caprine arthritis-encephalitis virus)	Small ruminant lentivirus genotype B (Caprine arthritis-encephalitis virus)	SRLVB 	Capra aegagrus hircus	Goat	9189
M60609	M60609_SRLV-A_RT		II	Orthoretrovirinae	Lentivirus		Lentivirus ovivismae	Small ruminant lentivirus genotype A (Visna-Maedi Virus)	Small ruminant lentivirus genotype A (Visna-Maedi Virus)	SRLVA 	Ovis aries	Sheep	9221
AF033819	AF033819_HIV1M_RT		II	Orthoretrovirinae	Lentivirus		Lentivirus humimdef1	human immunodeficiency virus 2	Human immunodeficiency virus 2	HIV1M 	Homo sapiens	Human	
M30502	M30502_HIV2_RT		II	Orthoretrovirinae	Lentivirus		Lentivirus humimdef2	Human immunodeficiency virus 2	Human immunodeficiency virus 2	HIV2	Homo sapiens	Human	10359
M58410	M58410_SIV_RT		II	Orthoretrovirinae	Lentivirus		Lentivirus simimdef	Simian immunodeficiency virus	Simian immunodeficiency virus	SIV		African green monkey	9623
AF033822	AF033822_WDSV_RT	NC_001867	I	Orthoretrovirinae	Epsilonretrovirus		Epsilonretrovirus waldersar	Walleye dermal sarcoma virus	Walleye dermal sarcoma virus	WDSV	Sander vitreus	Walleye fish	12708
AF133051	AF133051_WEHV1_RT		I	Orthoretrovirinae	Epsilonretrovirus		Epsilonretrovirus walepihyp1	walleye epidermal hyperplasia virus type 1	Walleye epidermal hyperplasia virus type 1	WEHV1	Sander vitreus	Walleye fish	12999
AF133052	AF133052_WEHV2_RT		I	Orthoretrovirinae	Epsilonretrovirus		Epsilonretrovirus walepihyp2	walleye epidermal hyperplasia virus type 2	Walleye epidermal hyperplasia virus type 2	WEHV2	Sander vitreus	Walleye fish	13125
AF151794	AF151794_KoRV_RT	NC_039228	I	Orthoretrovirinae	Gammaretrovirus		Gammaretrovirus koa	Koala retrovirus	Koala retrovirus	KoRV	Phascolarctos cinereus	Koala bear	8431
M26927	M26927_GaLV_RT	NC_001885	I	Orthoretrovirinae	Gammaretrovirus		Gammaretrovirus gibleu	gibbon ape leukemia virus	Gibbon ape leukemia virus	GaLV	Hylobatidae	Gibbons	8088
AF033811	AF033811_MLV_RT	NC_001501	I	Orthoretrovirinae	Gammaretrovirus		Gammaretrovirus murleu	Moloney murine leukemia virus	Moloney murine leukemia virus	MLV	Mus musculus	Domestic mouse	8332
AF052723	AF052723_FeLV_RT	NC_001940	I	Orthoretrovirinae	Gammaretrovirus		Gammaretrovirus felleu	feline leukemia virus	Feline leukemia virus	FeLV	Felis catus	Domestic cat	8448
AY842951	AY842951_REV_RT	NC_006934	I	Orthoretrovirinae	Gammaretrovirus		Gammaretrovirus aviretend	reticuloendotheliosis virus	Reticuloendotheliosis virus	REV	Gallus gallus	Domestic chicken	8295
AF356697	AF356697_PERVE_RT		I	Orthoretrovirinae	Gammaretrovirus		Gammaretrovirus porConc	porcine endogenous retrovirus E	Porcine endogenous retrovirus E	PERVE	Sus scrofa	Domestic pig	8072
U94514	U94514_BFV_RT	NC_001831	III	Spumaretrovirinae	Spumavirus	Bovispumavirus	Bovispumavirus bostau	bovine foamy virus Bos taurus	Bovine foamy virus	BFV	Bos taurus	Domestic cow	12002
AF201902	AF201902_EFV_RT	NC_002201	III	Spumaretrovirinae	Spumavirus	Equispumavirus	Equispumavirus equcab	equine foamy virus Equus caballus	Equine foamy virus	EFV	Equus caballus	Domestic horse	12035
AJ564746	AJ564746_FFV_RT	NC_039242	III	Spumaretrovirinae	Spumavirus	Felispumavirus	Felispumavirus felcat	feline foamy virus Felis catus	Feline foamy virus	FFV	Felis catus	Domestic cat	11700
EU010385	EU010385_SFVspi_RT	NC_039027	III	Spumaretrovirinae	Spumavirus	Simispumavirus	Simiispumavirus atespp	simian foamy virus Ateles spp.	Spider monkey simian foamy virus	SFVspi	Simia paniscus	Spider monkeys	12212
GU356394	GU356394_SFVsqu_RT	NC_039028	III	Spumaretrovirinae	Spumavirus	Simispumavirus	Simiispumavirus saisci	simian foamy virus Saimiri sciureus	Squirrel monkey simian foamy virus	SFVsqu	Saimiri	Squirrel monkeys	11684
GU356395	GU356395_SFVmarm_RT	NC_039030	III	Spumaretrovirinae	Spumavirus	Simispumavirus	Simiispumavirus caljac	simian foamy virus Callithrix jacchus	White-tufted-ear marmoset simian foamy virus	SFVmarm	Callithrix jacchus	White-tufted-ear marmoset	11744
KP143760	KP143760_SFVcapu_RT		III	Spumaretrovirinae	Spumavirus	Simispumavirus	Simiispumavirus sapxan	simian foamy virus Sapajus xanthosternos	Yellow-breasted capuchin simian foamy virus	SFVcapu	Sapajus xanthosternos	Yellow-breasted capuchin	11764
KM233624	KM233624_PSFVgal_RT	NC_039023	III	Spumaretrovirinae	Spumavirus	Simispumavirus	Prosimiispumavirus otocra	simian foamy virus Otolemur crassicaudatus	Brown greater galago prosimian foamy virus	PSFVgal	Otolemur crassicaudatus	Brown greater galago	12118
AJ544579	AJ544579_SFVora_RT	NC_039085	III	Spumaretrovirinae	Spumavirus	Simispumavirus	Simiispumavirus ponpygpyg	simian foamy virus Pongo pygmaeus pygmaeus	Simian foamy virus Pongo pygmaeus pygmaeus	SFVora	Pongo pygmaeus	Orangutan	12823
M74895	M74895_SFV3_RT		III	Spumaretrovirinae	Spumavirus	Simispumavirus	Simiispumavirus chlaet	simian foamy virus Chlorocebus aethiops	Grivet simian foamy virus	SFV3	Chlorocebus aethiops	Grivet	13111
U04327	U04327_SFVcpz_RT	NC_001364	III	Spumaretrovirinae	Spumavirus	Simispumavirus	Simiispumavirus pantrover	simian foamy virus Pan troglodytes verus	Western chimpanzee simian foamy virus	SFVcpz	Pan troglodytes	Chimpanzee	13246
X54482	X54482_SFV1_RT		III	Spumaretrovirinae	Spumavirus	Simispumavirus	Simiispumavirus maccyc	simian foamy virus Macaca cyclopis	Macaque simian foamy virus	SFV1	Macaca mulatta	Rhesus macaque	12972
HM245790	HM245790_SFVgor_RT	NC_039029	III	Spumaretrovirinae	Spumavirus	Simispumavirus	Simiispumavirus gorgorgor	simian foamy virus Gorilla gorilla gorilla	Western lowland gorilla simian foamy virus	SFVgor	Gorilla gorilla	Gorilla	12258
JQ867463	JQ867463_SFVcptt_RT		III	Spumaretrovirinae	Spumavirus	Simispumavirus	Simiispumavirus pantrotro	simian foamy virus Pan troglodytes troglodytes	Simian foamy virus Pan troglodytes troglodytes	SFVcptt	Pongo pygmaeus	Orang utan	13220
JQ867466	JQ867466_SFVgue_RT	NC_043445	III	Spumaretrovirinae	Spumavirus	Simispumavirus	Simiispumavirus cernic	simian foamy virus Cercopithecus nictitans	Guenon simian foamy virus	SFVgue	Cercopithecus nictitans	Greater spot-nosed monkey	13072
KX087159	KX087159_SFVcpze_RT		III	Spumaretrovirinae	Spumavirus	Simispumavirus	Simiispumavirus pantrosch	simian foamy virus Pan troglodytes schweinfurthii	Eastern chimpanzee simian foamy virus	SFVcpze	Pan troglodytes	Chimpanzee	11954
LC094267	LC094267_SFV_RT		III	Spumaretrovirinae	Spumavirus	Simispumavirus	Simiispumavirus macfas	simian foamy virus Macaca fascicularis	Simian foamy virus	SFV	Macaca fascicularis	Crab-eating macaque	12965
MF280817	MF280817_SFVrmac_RT		III	Spumaretrovirinae	Spumavirus	Simispumavirus	Simiispumavirus macmul	simian foamy virus Macaca mulatta	Rhesus macaque simian foamy virus	SFVrmac	Macaca mulatta	Rhesus macaque	12983
AB923518	AB923518_SFVjmac_RT		III	Spumaretrovirinae	Spumavirus	Simispumavirus	Simiispumavirus macfus	simian foamy virus Macaca fuscata	Japanese macaque simian foamy virus	SFVjmac	Macaca fuscata	Japanese macaque	12957